{
  "protocol_version": "1.0",
  "worker_id": "implementer-7",
  "task_id": "T-2026-04-23-W08-step-2",
  "status": "partial",
  "artifacts": [
    { "kind": "file",   "path": "src/retry.py", "action": "edited", "bytes": 2104 },
    { "kind": "commit", "sha": "b71e09d", "message": "wip: replace bare except in retry path (3 of 7 sites)" }
  ],
  "continuation": {
    "reason": "token_budget_hit",
    "next_task": {
      "instruction": "Continue replacing bare 'except:' clauses with typed exceptions in src/retry.py. 3 of 7 sites done. Remaining sites: lines 142, 198, 261, 304. Reference the pattern used at line 88.",
      "context_pointers": [
        "src/retry.py:88",
        "src/retry.py:142",
        "src/retry.py:198",
        "src/retry.py:261",
        "src/retry.py:304",
        "commit:b71e09d"
      ]
    }
  },
  "diagnostics": {
    "tokens_in": 198002,
    "tokens_out": 22104,
    "wall_seconds": 488,
    "tool_calls": 92,
    "cache_hit_rate": 0.81,
    "model": "claude-opus-4.7"
  },
  "human_summary": "Replaced 3 of 7 bare 'except:' clauses in src/retry.py with typed handlers. Hit per-task token budget; continuation describes the remaining 4 sites and the pattern to follow."
}
